term,QID,wd_bow,spacy_cs,check,link_wd
negroes,Q104939765,"statement, supporting, american, negro, struggle, racial, discrimination, imperialism, public, statement, statement, calling, people, world, unite, oppose, racial, discrimination, imperialism, support, american, negro, struggle, racial, discrimination",0.772,TRUE,https://www.wikidata.org/wiki/Q104939765
negroes,Q19884657,"among, social, condition, existed, partly, cause, migration, injustice, done, negro, court, painting, painting, jacob, lawrence",0.769,TRUE,https://www.wikidata.org/wiki/Q19884657
negroes,Q60746694,"bad, air, smelled, african, american, negro, black, post, black, use, instead, change, print, print, carl, pope, american, tribune, showprint",0.761,TRUE,https://www.wikidata.org/wiki/Q60746694
negroes,Q19884625,"housing, negro, difficult, problem, painting, painting, jacob, lawrence",0.758,TRUE,https://www.wikidata.org/wiki/Q19884625
negroes,Q111842219,"extension, work, among, negro, photograph, photograph, artist, unknown",0.748,TRUE,https://www.wikidata.org/wiki/Q111842219
negros,Q39056887,"mascogos, ethnic, community, black, seminole, afro, mexican, negro, mascagos, afrodescendent, group, coahuila, mexico",0.82,TRUE,https://www.wikidata.org/wiki/Q39056887
negros,Q28777955,"landscape, black, people, painting, paisagem, com, negro, atribuído, painting, eduard, hildebrandt",0.812,FALSE,https://www.wikidata.org/wiki/Q28777955
negros,Q62027814,"negro, oriental, state, university, historical, marker, national, historical, commission, philippine, historical, marker, nhcp, historical, marker, negro, oriental, state, university",0.781,FALSE,https://www.wikidata.org/wiki/Q62027814
negros,Q50413489,"surrender, japanese, force, negro, oriental, historical, marker, national, historical, commission, philippine, historical, marker, nhcp, historical, marker, surrender, japan, negro, end, world, war, ii",0.777,FALSE,https://www.wikidata.org/wiki/Q50413489
negros,Q56893358,"capitol, negro, occidental, historical, marker, national, historical, commission, philippine, historical, marker, nhcp, historical, marker, negro, occidental, capitol",0.777,FALSE,https://www.wikidata.org/wiki/Q56893358
negros,Q56810851,"site, spanish, force, surrendered, negro, occidental, historical, marker, national, historical, commission, philippine, historical, marker, nhcp, historical, marker, site, spanish, force, surrendered, negro, occidental",0.775,FALSE,https://www.wikidata.org/wiki/Q56810851
negros,Q50426496,"pantaleon, villegas, historical, marker, nhcp, historical, marker, león, kilat, negro, oriental",0.766,FALSE,https://www.wikidata.org/wiki/Q50426496
negros,Q51448114,"bird, negro, island, publication, natural, history, university, library, university, illinois, urbana, champaign, view, book",0.765,FALSE,https://www.wikidata.org/wiki/Q51448114
negros,Q55578325,"natural, watercourse, negro, occidental, philippine",0.764,FALSE,https://www.wikidata.org/wiki/Q55578325
negros,Q111944273,"negro, trench, geological, feature, philippine",0.76,FALSE,https://www.wikidata.org/wiki/Q111944273
page,Q7124279,"boy, role, young, male, attendant, wedding",0.766,TRUE,https://www.wikidata.org/wiki/Q7124279
page,Q67184216,"wikimedia, list, person, gender, occupation, wikimedia, list, person, sex, occupation, wikimedia, project, listing, person, gender, occupation",0.741,FALSE,https://www.wikidata.org/wiki/Q67184216
page,Q67187625,"wikimedia, list, person, nationality, occupation, wikimedia, list, person, occupation, nationality, wikimedia, project, listing, person, nationality, occupation",0.734,FALSE,https://www.wikidata.org/wiki/Q67187625
page,Q1451816,"ministry, ministry, affair, ministry, woman, ministry, gender, equality, ministry, woman, desambiguation",0.731,FALSE,https://www.wikidata.org/wiki/Q1451816
page,Q44374960,"former, imdb, character, wikibase, reason, deprecated, rank, ch, character, former, internet, movie, database, character, identifier, character, old, imdb, identifier, set, deprecate, rank",0.719,FALSE,https://www.wikidata.org/wiki/Q44374960
page,Q66666236,"wikimedia, list, person, occupation, wikimedia, list, person, profession, list, person, occupation, list, person, profession, wikimedia, project, listing, person, occupation",0.707,FALSE,https://www.wikidata.org/wiki/Q66666236
page,Q42097313,"object, památkový, katalog, given, úskp, identifier, wikibase, reason, deprecated, rank, úskp, identifier, assigned, corresponding, record, czech, monument, catalog",0.705,FALSE,https://www.wikidata.org/wiki/Q42097313
page,Q17379835,"wikimedia, outside, main, knowledge, tree, wikimedia, instance, class, describe, wikimedia, outside, world, concept, described",0.702,FALSE,https://www.wikidata.org/wiki/Q17379835
page,Q630790,"front, title, first, also, important, multi, printed, work",0.697,FALSE,https://www.wikidata.org/wiki/Q630790
page,Q61944114,"one, language, name, another, language, wikidata, specific, criterion, wikidata, specific, criterion",0.685,FALSE,https://www.wikidata.org/wiki/Q61944114
pages,Q59829003,"one, language, disambiguation, page, name, page, another, language, one, language, page, ambiguity, name, page, another, language, wikidata, specific, criterion, related, disambiguation, page",0.81,FALSE,https://www.wikidata.org/wiki/Q59829003
pages,Q103165303,"yeats, inventing, verse, life, apprentice, mage, oxford, university, page, news, article",0.794,FALSE,https://www.wikidata.org/wiki/Q103165303
pages,Q55643860,"european, senior, master, list, sport, related, page, similar, name",0.794,FALSE,https://www.wikidata.org/wiki/Q55643860
pages,Q63677482,"saxon, thuringian, brabantian, count, noble, lady, honor, page, vassal, serf, operatic, character, fictional, human",0.791,TRUE,https://www.wikidata.org/wiki/Q63677482
pages,Q2287154,"website, fact, checker, organization, snopes, urban, legend, reference, page, fact, checking, website",0.79,FALSE,https://www.wikidata.org/wiki/Q2287154
pages,Q67519403,"peking, domestic, service, chen, poem, condemning, indonesian, read, processed, ncna, daily, report, april, page, naid, item, collection, exhibition, item, national, archive, record, holding",0.786,FALSE,https://www.wikidata.org/wiki/Q67519403
pages,Q101420143,"facebook, page, fb, page, page, facebook, dedicated, business, brand, organization, public, figure",0.785,FALSE,https://www.wikidata.org/wiki/Q101420143
pages,Q6728626,"madrid, master, list, sport, related, page, similar, name",0.785,FALSE,https://www.wikidata.org/wiki/Q6728626
pages,Q59168588,"soldier, civilian, later, roman, ramsey, page, harvard, university, press, academic, journal, article",0.783,FALSE,https://www.wikidata.org/wiki/Q59168588
pages,Q709369,"man, standard, unix, utility, reading, manual, page",0.781,FALSE,https://www.wikidata.org/wiki/Q709369
primitive,Q1942010,"modern, subculture, people, developed, culturally, altered, post, colonial, nation, engage, body, modification, ritual, practice",0.92,TRUE,https://www.wikidata.org/wiki/Q1942010
primitive,Q6453739,"notion, concept, undefined, term, motivated, informally, usually, appeal, intuition, everyday, experience, introduced, axiomatically, eventually, generated, series, elementary, operation",0.892,FALSE,https://www.wikidata.org/wiki/Q6453739
primitive,Q42193895,"origin, civilization, condition, man, creative, work",0.868,TRUE,https://www.wikidata.org/wiki/Q42193895
primitive,Q18344558,"decorating, decoration, style, decorating, using, folk, art, style, characteristic, historic, early, americana, time, period",0.861,TRUE,https://www.wikidata.org/wiki/Q18344558
primitive,Q77177747,"outline, characteristic, welsh, utility, connection, ancient, language, developing, speech, mankind, written, work, book, work",0.856,TRUE,https://www.wikidata.org/wiki/Q77177747
primitive,Q51462654,"definition, art, publication, natural, history, field, museum, natural, history, library",0.847,TRUE,https://www.wikidata.org/wiki/Q51462654
primitive,Q111808928,"topographical, feature, caused, experience, hero, demigod, deity, narrative, motif, motif, topographical, feature, caused, experience, hero, demigod, topographical, feature, caused, experience, hero, topographical, feature, caused, experience, demigod, topographical, feature, caused, experience, deity, narrative, motif, documented, motif, index, folk, literature",0.844,FALSE,https://www.wikidata.org/wiki/Q111808928
primitive,Q111442125,"study, archaic, form, social, movement, century, written, work, rebel, social, bandit, rebel, book, eric, hobsbawm",0.839,TRUE,https://www.wikidata.org/wiki/Q111442125
primitive,Q108291623,"ashanti, proverb, ethic, savage, people, translated, original, grammatical, anthropological, note, report, heritage",0.838,TRUE,https://www.wikidata.org/wiki/Q108291623
primitive,Q76904144,"outline, characteristic, welsh, utility, connection, ancient, language, developing, speech, mankind, version, edition, translation, published",0.827,TRUE,https://www.wikidata.org/wiki/Q76904144
primitives,Q443153,"early, netherlandish, painting, art, movement, culture, style, northern, renaissance, flemish, primitive, work, artist, active, low, country, century, northern, renaissance",0.891,TRUE,https://www.wikidata.org/wiki/Q443153
primitives,Q3403250,"italian, primitive, art, movement, artistic, movement, painting, group, beginning, italian, renaissance",0.875,TRUE,https://www.wikidata.org/wiki/Q3403250
primitives,Q112983131,"primitive, business, primitive, nv, specialist, format, distributor, originating, flanders, formed, three, largest, independent, production, house, belgium",0.847,FALSE,https://www.wikidata.org/wiki/Q112983131
primitives,Q112666388,"primitive, discography, discography, primitive",0.837,FALSE,https://www.wikidata.org/wiki/Q112666388
primitives,Q111636861,"skill, transfer, human, robot, based, dynamic, movement, primitive, sparse, autoencoder, thesis, thesis",0.825,FALSE,https://www.wikidata.org/wiki/Q111636861
primitives,Q110167232,"master, popular, modern, primitive, europe, america, art, exhibition, event, exhibition, rockefeller, center, organized, museum, modern, art",0.819,TRUE,https://www.wikidata.org/wiki/Q110167232
primitives,Q113575539,"hyla, typescript, library, implementing, computational, geometry, primitive",0.817,FALSE,https://www.wikidata.org/wiki/Q113575539
primitives,Q113668090,"use, performance, communication, primitive, software, controlled, cache, coherent, cluster, architecture, doctoral, thesis, doctoral, thesis, xiaohan, qin, computer, science, engineering, university, washington",0.817,FALSE,https://www.wikidata.org/wiki/Q113668090
primitives,Q3075281,"sponge, function, sponge, construction, class, algorithm, finite, internal, state, take, input, bit, stream, length, produce, output, bit, stream, desired, length, used, model, implement, many, cryptographic, primitive",0.806,FALSE,https://www.wikidata.org/wiki/Q3075281
primitives,Q4041442,"intel, integrated, performance, primitive, software, library, integrated, performance, primitive, software, library",0.798,FALSE,https://www.wikidata.org/wiki/Q4041442
primitivism,Q10336318,"neo, art, movement, neoprimitivism, russian, art, movement",0.887,TRUE,https://www.wikidata.org/wiki/Q10336318
primitivism,Q110893128,"century, affinity, tribal, modern, art, exhibition, event, exhibition, museum, modern, art",0.88,TRUE,https://www.wikidata.org/wiki/Q110893128
primitivism,Q54637456,"modern, art, literary, work, goldwater, robert",0.867,TRUE,https://www.wikidata.org/wiki/Q54637456
primitivism,Q58429779,"impossible, art, academic, journal, article",0.819,TRUE,https://www.wikidata.org/wiki/Q58429779
primitivism,Q1662181,"new, subculture, music, genre, music, movement, subcultural, movement, established, sarajevo, sr, bosnia, herzegovina, sfr, yugoslavia, march",0.809,TRUE,https://www.wikidata.org/wiki/Q1662181
primitivism,Q79263662,"modern, art, art, exhibition, exhibition, sfmoma, san, francisco, museum, art",0.806,TRUE,https://www.wikidata.org/wiki/Q79263662
primitivism,Q59580543,"pristine, purity, practical, piety, john, art, physic, thesis, doctoral, thesis, deborah, madden",0.792,FALSE,https://www.wikidata.org/wiki/Q59580543
primitivism,Q114569728,"science, irish, revival, literary, work",0.79,TRUE,https://www.wikidata.org/wiki/Q114569728
primitivism,Q667672,"anarcho, political, ideology, anarchist, school, thought, individualist, anarchism, green, anarchism, anprim, form, anarchism",0.76,FALSE,https://www.wikidata.org/wiki/Q667672
primitivism,Q16591771,"music, genre, music, movement, primitivist, music, music, musical, movement",0.732,TRUE,https://www.wikidata.org/wiki/Q16591771
pygmy,Q171927,"people, ethnic, group, aka, baka, mbuti, pueblo, pigmeos, pigmeos, pigmeo, pigmeo, africano, gente, del, bosque, ethnic, group, whose, average, height, unusually, short",0.817,TRUE,https://www.wikidata.org/wiki/Q171927
pygmy,Q3039820,"mbuti, people, bambuti, people, bambuti, indigenous, group, congo, region, africa",0.754,TRUE,https://www.wikidata.org/wiki/Q3039820
pygmy,Q111965527,"specie, delimitation, population, genetics, rare, case, study, using, new, zealand, native, forget, group, boraginaceae, doctoral, thesis, doctoral, thesis, jessica, mary, prebble, massey, university",0.754,FALSE,https://www.wikidata.org/wiki/Q111965527
pygmy,Q113471961,"robert, peter, peter, author, thesis, stanford, university, titled, dimorphism, male, mating, behavior, associated, size, class, swordtail, xiphophorus, pygmaeus, nigrensis, poeciliidae, pisces, study, competing, male, strategy",0.754,FALSE,https://www.wikidata.org/wiki/Q113471961
pygmy,Q113472233,"dimorphism, male, mating, behavior, associated, size, class, swordtail, xiphophorus, pygmaeus, nigrensis, poeciliidae, pisces, study, competing, male, strategy, doctoral, thesis, thesis, submitted, stanford, university, robert, peter",0.748,FALSE,https://www.wikidata.org/wiki/Q113472233
pygmy,Q1747200,"fictional, ethnic, group, mythical, ethnic, group, tribe, diminutive, human, greek, mythology",0.747,TRUE,https://www.wikidata.org/wiki/Q1747200
pygmy,Q13560329,"seahorse, organism, known, particular, common, name, common, name, several, specie, fish",0.745,FALSE,https://www.wikidata.org/wiki/Q13560329
pygmy,Q5624044,"gyele, people, ethnic, group, gabon, equatorial, guinea",0.741,TRUE,https://www.wikidata.org/wiki/Q5624044
pygmy,Q6362821,"kango, people, mbuty, people, ituri, rainforest, eastern, democratic, republic, congo",0.738,TRUE,https://www.wikidata.org/wiki/Q6362821
pygmy,Q110142534,"wildlife, human, creating, mindful, link, visitor, elephant, territory, thesis, written, work, thesis, justine, megan, loong, university, washington",0.73,FALSE,https://www.wikidata.org/wiki/Q110142534
queer,Q51415,"reappropriation, umbrella, term, identity, gender, identity, sexual, identity, umbrella, term, sexual, gender, minority, heterosexual, heteronormative, cisgender",0.929,TRUE,https://www.wikidata.org/wiki/Q51415
queer,Q2353191,"heterosexuality, human, sexuality, identity, heterosexuality, heteroqueer, straight, heterosexual, queerhet, heterosexual, practice, identity, controversially, labelled",0.917,TRUE,https://www.wikidata.org/wiki/Q2353191
queer,Q109497759,"sexuality, gender, justice, rethinking, normative, heterosexuality, sexual, justice, perspective, humanist, men, masculinity, study, doctoral, thesis, doctoral, thesis, chieh, wang",0.841,TRUE,https://www.wikidata.org/wiki/Q109497759
queer,Q115870510,"identity, sexual, identity, lgbt, identity, lgbt, identity, lgbt, variation, identity, identity, lgbt, identity, identity, identity, identity, term, person",0.828,TRUE,https://www.wikidata.org/wiki/Q115870510
queer,Q112865153,"indigiqueer, person, indigiqueer, people, indigiqueers, indigenous, person, recognizes, identity, salient, indigenous, identity, vice, versa",0.802,TRUE,https://www.wikidata.org/wiki/Q112865153
queer,Q27887364,"pramada, menon, feminist, activist, stand, comedian, gender, sexuality, consultant",0.8,TRUE,https://www.wikidata.org/wiki/Q27887364
queer,Q339014,"non, heterosexuality, sexual, orientation, lgbt, human, sexuality, aheterosexuality, non, heterosexual, aheterosexual, non, cisheterosexuality, sexual, orientation, heterosexual, straight",0.791,TRUE,https://www.wikidata.org/wiki/Q339014
queer,Q108292272,"placemaking, community, building, among, lesbian, bisexual, lbq, woman, non, binary, people, covid, pandemic, thesis, thesis, gabby, unipan",0.79,TRUE,https://www.wikidata.org/wiki/Q108292272
queer,Q112924898,"contemporary, discourse, sexuality, gender, mainstream, medium, implication, politics, thesis, thesis, rearna, hartmann, university, auckland",0.788,TRUE,https://www.wikidata.org/wiki/Q112924898
queer,Q56282687,"erasure, discrimination, queerphobia, queermisia, misia, phobia, heteronormative, cultural, practice",0.787,TRUE,https://www.wikidata.org/wiki/Q56282687
queerer,Q65088015,"material, sexualität, ökonomie, perspektiven, antikapitalistischer, politik, economy, prospect, queer, anticapitalist, written, work, essay, cornelia, möser",0.669,TRUE,https://www.wikidata.org/wiki/Q65088015
queerest,Q51164947,"daddy, television, series, episode, episode, american",0.334,FALSE,https://www.wikidata.org/wiki/Q51164947
queers,Q7271166,"queer, undermining, israeli, terrorism",0.738,TRUE,https://www.wikidata.org/wiki/Q7271166
queers,Q106438598,"lgbt, mexican, american, group, human, hispanic, latino, american, people, xicanx, queer, queer, chicano, mexican, american, people, identify, member, lgbt, community",0.732,TRUE,https://www.wikidata.org/wiki/Q106438598
queers,Q75016680,"queer, lover, hateful, regenerating, violent, time, place, written, work",0.725,TRUE,https://www.wikidata.org/wiki/Q75016680
queers,Q5439901,"fed, queer, advocacy, group, right, organization",0.656,TRUE,https://www.wikidata.org/wiki/Q5439901
queers,Q7271168,"queer, israeli, apartheid, organization, toronto, based, lgbt, protest, movement",0.654,TRUE,https://www.wikidata.org/wiki/Q7271168
queers,Q107343107,"queersinscience, initiative, queer, science, qi, initiative, supporting, people, stemm, field, australia",0.644,TRUE,https://www.wikidata.org/wiki/Q107343107
queers,Q75016873,"queer, lover, hateful, regenerating, violent, time, place, version, edition, translation, book, edition",0.637,TRUE,https://www.wikidata.org/wiki/Q75016873
queers,Q58436736,"queer, marriage, literary, work, book, greg, wharton, ian, philip",0.635,TRUE,https://www.wikidata.org/wiki/Q58436736
queers,Q114430131,"zombie, migrant, race, crisis, capitalism, pop, culture, literary, work",0.631,TRUE,https://www.wikidata.org/wiki/Q114430131
queers,Q7271167,"queer, history, literary, work, book, keith, stern",0.623,TRUE,https://www.wikidata.org/wiki/Q7271167
race,Q57203016,"discrimination, pegi, discrimination, discrimination, pegi, pegi, video, game, content, rating, game, may, contain, scene, behavior, reference, cruelty, harassment, group, specific, people, based, religion, gender, sexuality",0.879,TRUE,https://www.wikidata.org/wiki/Q57203016
race,Q365143,"ethnopluralism, ethno, pluralism, right, wing, ethno, nationalist, associated, model, nation, would, formed, basis, culture, interest, preserving, cultural, genetic, heritage",0.877,TRUE,https://www.wikidata.org/wiki/Q365143
race,Q2042898,"historical, concept, human, categorization, historical, definition, disused, concept, disused, definition, archaic, concept, archaic, definition, deprecated, concept, deprecated, definition, disused, conception, racial, ethnic, makeup",0.871,TRUE,https://www.wikidata.org/wiki/Q2042898
race,Q30103,"minority, group, special, population, minority, group, demographic, minority, minority, minority, group, people, practice, religion, ethnicity, characteristic, fewer, number, main, group, classification",0.869,TRUE,https://www.wikidata.org/wiki/Q30103
race,Q296519,"ecotype, ecospecies, genetically, distinct, geographic, variety, population, within, specie",0.86,TRUE,https://www.wikidata.org/wiki/Q296519
race,Q27863646,"mythical, people, class, mythical, entity, mythical, ethnic, group, mythical, people, mythical, mythological, people, mythological, people, mythological, legendary, people, plurality, person, mythology",0.857,TRUE,https://www.wikidata.org/wiki/Q27863646
race,Q2330715,"mediterranean, human, categorization, culture, caucasian, mediterranid, mediterranean, mediterranean, people, causcasian, sub",0.857,TRUE,https://www.wikidata.org/wiki/Q2330715
race,Q22273995,"modulation, symbiont, host, resistance, gene, dependent, defense, response, biological, process, response, host, modulation, organism, host, gene, gene, resistance, modulation, organism, defense, response, host, specific, elicitors, modulation, organism, pathogen, host, plant, cultivar, specific, resistance, symbiont, process, organism, modulates, frequency, rate, extent, resistance, gene, dependent, defense, response, host, host, defined, larger, organism, involved, symbiotic",0.854,FALSE,https://www.wikidata.org/wiki/Q22273995
race,Q7279589,"racial, politics, politics, racism, identity, politics, discrimination, politics, use, human, categorization, hierarchical, identifier, political, discourse, campaign, within, societal, cultural, climate, created, practice, including, exploiting, issue, forward, political, agenda",0.845,TRUE,https://www.wikidata.org/wiki/Q7279589
race,Q1047554,"mutual, exclusion, mutex, property, concurrency, control, instituted, purpose, preventing, condition",0.845,FALSE,https://www.wikidata.org/wiki/Q1047554
races,Q3254959,"race, human, categorization, classification, system, identity, race, race, mankind, race, classification, system, used, categorize, human, basis, hereditary, physical, trait",0.958,TRUE,https://www.wikidata.org/wiki/Q3254959
races,Q1141593,"racialism, racial, theory, belief, human, specie, naturally, divided, race, ostensibly, distinct, biological, category",0.921,TRUE,https://www.wikidata.org/wiki/Q1141593
races,Q116505449,"canoe, race, lièvre, intentional, human, activity, racing, element, intangible, heritage",0.905,FALSE,https://www.wikidata.org/wiki/Q116505449
races,Q7166094,"peopling, india, immigration, pattern, different, race, people",0.897,TRUE,https://www.wikidata.org/wiki/Q7166094
races,Q100474769,"race, equality, situation, people, race, treated, fairly, way",0.89,TRUE,https://www.wikidata.org/wiki/Q100474769
races,Q19097704,"relation, advanced, backward, race, mankind",0.887,TRUE,https://www.wikidata.org/wiki/Q19097704
races,Q5476,"race, revelation, space, character, race, list, fictional, alien, modified, human, race",0.886,TRUE,https://www.wikidata.org/wiki/Q5476
races,Q5752079,"hidden, race, class, fictional, entity, fictional, humanoid, specie, collection, unrelated, race",0.883,FALSE,https://www.wikidata.org/wiki/Q5752079
races,Q7279580,"racial, equality, biological, social, equal, regard, race, human",0.867,TRUE,https://www.wikidata.org/wiki/Q7279580
races,Q25340083,"futurity, race, younger, horse, wherein, must, nominated, well, advance, actual, competition",0.863,FALSE,https://www.wikidata.org/wiki/Q25340083
retarded,Q112847738,"recognizing, facial, expression, emotion, assessment, training, generalization, mentally, person, thesis, thesis, christopher, mcalpine, university, canterbury",0.89,TRUE,https://www.wikidata.org/wiki/Q112847738
retarded,Q112847043,"remediation, spelling, deficit, mentally, child, comparative, efficacy, overcorrection, interspersal, training, thesis, thesis, tina, haggar, university, canterbury",0.886,TRUE,https://www.wikidata.org/wiki/Q112847043
retarded,Q115542878,"algerian, semi, private, initiative, psycho, pedagogy, algerian, experiment, semi, private, initiative, field, psycho, pedagogical, help, mentally, child, adolescent",0.873,TRUE,https://www.wikidata.org/wiki/Q115542878
retarded,Q112845941,"spelling, deficit, mentally, child, comparison, alternative, remediation, strategy, thesis, thesis, vicky, marie, anderson, university, canterbury",0.867,TRUE,https://www.wikidata.org/wiki/Q112845941
retarded,Q112108108,"evaluation, gentle, teaching, visual, screening, reduction, stereotypy, mentally, person, thesis, thesis, jennifer, jordan, university, canterbury",0.863,TRUE,https://www.wikidata.org/wiki/Q112108108
retarded,Q74277620,"effect, dual, task, balance, training, cognitive, function, people, mental, clinical, trial, clinical, trial",0.86,TRUE,https://www.wikidata.org/wiki/Q74277620
retarded,Q112848650,"acquisition, sight, word, mentally, child, effect, overcorrection, extra, stimulus, prompt, thesis, thesis, elizabeth, margaret, stringer, university, canterbury",0.844,TRUE,https://www.wikidata.org/wiki/Q112848650
retarded,Q7921702,"vermont, defendant, accommodation, project, project, identifying, need, mentally, criminal, defendant",0.842,TRUE,https://www.wikidata.org/wiki/Q7921702
retarded,Q112838250,"comparison, several, operant, procedure, severely, child, thesis, thesis, alan, norman, ewen, fugler, university, waikato",0.842,TRUE,https://www.wikidata.org/wiki/Q112838250
retarded,Q19709948,"congenital, heart, defect, round, face, developmental, delay, syndrome, developmental, defect, embryogenesis, class, disease, disease, multiple, congenital, anomaly, dysmorphic, syndrome, intellectual, disability, genetic, syndromic, intellectual, disability, sonoda, syndrome, round, face, depressed, nasal, bridge, small, mouth, congenital, heart, defect, development, medical, condition",0.841,TRUE,https://www.wikidata.org/wiki/Q19709948
second world,Q233472,"second, world, group, geopolitical, classification",1,TRUE,https://www.wikidata.org/wiki/Q233472
second world,Q24040758,"group, resistance, group, second, world, war",0.874,FALSE,https://www.wikidata.org/wiki/Q24040758
second world,Q66198090,"special, research, history, role, communication, intelligence, submarine, warfare, japan, second, world, war, naid, collection, series, national, archive, record, holding",0.861,FALSE,https://www.wikidata.org/wiki/Q66198090
