term,QID,wd_bow,spacy_cs,check,link_wd
maroon,Q1542741,"palmares, community, escaped, slave, colonial, brazil",0.784,TRUE,https://www.wikidata.org/wiki/Q1542741
maroon,Q17379998,"formation, formation, geologic, formation, colorado, united, state",0.75,FALSE,https://www.wikidata.org/wiki/Q17379998
maroon,Q110143374,"role, land, orography, precipitation, ocean, circulation, global, climate, model, doctoral, dissertation, elizabeth, university, washington",0.747,FALSE,https://www.wikidata.org/wiki/Q110143374
maroon,Q31950560,"hole, bight, bight, saint, croix, united, state, virgin, island, united, state, america",0.744,FALSE,https://www.wikidata.org/wiki/Q31950560
maroon,Q48815098,"state, school, war, memorial, historic, site, queensland, australia",0.729,FALSE,https://www.wikidata.org/wiki/Q48815098
maroon,Q110143265,"location, tropical, precipitation, idealized, atmospheric, general, circulation, model, forced, andes, topography, surface, heat, flux, thesis, elizabeth, allison, university, washington",0.722,FALSE,https://www.wikidata.org/wiki/Q110143265
maroon,Q59535851,"biotech, united, state, business, company, chicago, united, state",0.721,FALSE,https://www.wikidata.org/wiki/Q59535851
maroon,Q49900146,"east, creek, natural, watercourse, natural, watercourse, pitkin, county, colorado, united, state, america",0.716,FALSE,https://www.wikidata.org/wiki/Q49900146
maroon,Q1093206,"jamaican, spirit, possession, language, sacred, language, language",0.715,TRUE,https://www.wikidata.org/wiki/Q1093206
maroons,Q445485,"maroon, ethnic, group, group, human, dictionary, page, wikipedia, african, refugee, escaped, slavery, america, descendant",0.911,TRUE,https://www.wikidata.org/wiki/Q445485
maroons,Q1415423,"quilombo, 𝚊𝚕𝚒á𝚜, 𝚊𝚕é𝚖, 𝚍𝚎, 𝚌𝚛𝚒𝚊𝚛, 𝚞𝚖𝚊, 𝚏𝚊𝚣𝚎𝚗𝚍𝚊, 𝚊𝚘𝚗𝚍𝚎, 𝚙𝚘𝚍𝚒𝚊𝚜, 𝚜𝚎𝚛, 𝚎𝚜𝚌𝚛𝚊𝚟𝚒𝚣𝚊𝚍𝚘, 𝚎𝚕𝚎𝚜, 𝚜𝚊í𝚛𝚊𝚖, 𝚍, brazilian, hinterland, human, settlement, founded, people, african, origin, including, quilombolas, maroon",0.884,TRUE,https://www.wikidata.org/wiki/Q1415423
maroons,Q6127426,"jamaican, maroon, ethnic, community, african, jamaican, maroon, leeward, maroon, windward, maroon, african, descendant, liberated, enslavement, formed, independent",0.83,TRUE,https://www.wikidata.org/wiki/Q6127426
maroons,Q112950919,"social, medium, live, streaming, reaching, engaging, case, facebook, live, queensland, maroon, doctoral, thesis, doctoral, thesis, sarah, wymer, massey, university",0.778,FALSE,https://www.wikidata.org/wiki/Q112950919
maroons,Q101413681,"queenslanders, human, population, australian, inhabitant, queensland, resident, banana, bender, banana, bender, cane, toad, maroon, resident, queensland, australia",0.732,FALSE,https://www.wikidata.org/wiki/Q101413681
maroons,Q107350976,"material, beginning, saramaka, maroon, archaeological, investigation, version, edition, translation, dissertation, dissertation, cheryl, ngwenyama, white",0.731,FALSE,https://www.wikidata.org/wiki/Q107350976
maroons,Q12341716,"yooka, religious, term, maroon",0.668,TRUE,https://www.wikidata.org/wiki/Q12341716
maroons,Q108540274,"maroon, people, wikimedia, category, wikimedia, category",0.654,TRUE,https://www.wikidata.org/wiki/Q108540274
maroons,Q8609501,"people, wikimedia, category, wikimedia, category",0.633,TRUE,https://www.wikidata.org/wiki/Q8609501
maroons,Q105429488,"fighting, maroon, basketball, player, wikimedia, category, wikimedia, category",0.601,FALSE,https://www.wikidata.org/wiki/Q105429488
medicine man,Q266750,"medicine, man, profession, healer, religious, leader, medicine, woman, medicine, man, native, american, traditional, healer, spiritual, leader",0.959,TRUE,https://www.wikidata.org/wiki/Q266750
medicine man,Q17516119,"györgy, szabó, human, uncle, gyuri, szabó, medicine, man, bükk, hungarian, naturopath",0.877,TRUE,https://www.wikidata.org/wiki/Q17516119
medicine man,Q104853010,"bawlpu, medicine, man, priest, traditional, mizo, village",0.867,TRUE,https://www.wikidata.org/wiki/Q104853010
medicine man,Q6144422,"james, trosper, native, american, medicine, man",0.85,TRUE,https://www.wikidata.org/wiki/Q6144422
medicine man,Q20188360,"yntah, medicine, man, warrior, woman, painting, painting, george, catlin",0.833,TRUE,https://www.wikidata.org/wiki/Q20188360
medicine man,Q5375597,"encouraging, bear, lakota, medicine, man",0.831,TRUE,https://www.wikidata.org/wiki/Q5375597
medicine man,Q20486967,"medicine, man, performing, mystery, dying, man, painting, painting, george, catlin",0.83,TRUE,https://www.wikidata.org/wiki/Q20486967
medicine man,Q486912,"sitting, bear, satank, prestigious, kiowa, warrior, medicine, man",0.83,TRUE,https://www.wikidata.org/wiki/Q486912
medicine man,Q56273914,"medicine, man",0.826,TRUE,https://www.wikidata.org/wiki/Q56273914
medicine man,Q797774,"ambilikile, mwasapile, medicine, man",0.826,TRUE,https://www.wikidata.org/wiki/Q797774
medicine men,Q79924032,"medicine, men, curing, sick, textile, textile, unknown, artist",0.806,TRUE,https://www.wikidata.org/wiki/Q79924032
medicine men,Q30441244,"ralph, samantha, medicine, men, musical, group",0.787,FALSE,https://www.wikidata.org/wiki/Q30441244
medicine men,Q51442135,"annual, ceremony, pawnee, medicine, men, publication, chicago, museum, natural, field, museum, natural, history, library",0.723,TRUE,https://www.wikidata.org/wiki/Q51442135
medicine men,Q79924009,"two, medicine, men, textile, textile, unknown, artist",0.714,TRUE,https://www.wikidata.org/wiki/Q79924009
medicine men,Q54641544,"chinese, medicine, consumer, culture, china, southeast, asia, literary, work, cochran, sherman",0.711,TRUE,https://www.wikidata.org/wiki/Q54641544
medicine men,Q64156076,"victoria, chipps, horn, chipps, lineage, medicine, men, birthday, great, grand, daughter, photograph, photograph, national, gallery, art, nga",0.71,TRUE,https://www.wikidata.org/wiki/Q64156076
medicine men,Q7750878,"medicine, men, musical, group, louisiana, american, music, production, group, new, orleans, louisiana",0.701,FALSE,https://www.wikidata.org/wiki/Q7750878
medicine men,Q67625494,"modern, indian, medicine, men, naid, item, collection, exhibition, item, national, archive, record, holding",0.696,TRUE,https://www.wikidata.org/wiki/Q67625494
medicine men,Q7750879,"medicine, men, television, series, episode, episode, avenger",0.549,FALSE,https://www.wikidata.org/wiki/Q7750879
medicine men,Q114534706,"medicine, men, television, series, episode, episode, mod, squad",0.485,FALSE,https://www.wikidata.org/wiki/Q114534706
mestizo,Q4974225,"bronze, race, racial, classification, used, since, early, century, latin, american, writer, refer, population, arose, america, arrival, latin, european, colonist, intermingling, new, amerindian, people",0.848,TRUE,https://www.wikidata.org/wiki/Q4974225
mestizo,Q3088076,"ladino, people, mix, hispanicized, people, latin, america, principally, central, america",0.817,TRUE,https://www.wikidata.org/wiki/Q3088076
mestizo,Q5448617,"filipino, ethnic, group, filipina, mestiza, racial, identifier",0.805,TRUE,https://www.wikidata.org/wiki/Q5448617
mestizo,Q17078871,"colombian, colombian, ethnic, group",0.75,TRUE,https://www.wikidata.org/wiki/Q17078871
mestizo,Q107342119,"relationship, internally, externally, generated, violence, andean, colombian, community, doctoral, thesis, doctoral, thesis, santiago, alvarez",0.741,TRUE,https://www.wikidata.org/wiki/Q107342119
mestizo,Q57234140,"genomics, race, mixture, nation, science, latin, america, version, edition, translation",0.707,TRUE,https://www.wikidata.org/wiki/Q57234140
mestizo,Q99061754,"architectural, style, baroque, architecture, colonial, latin, american, architecture, style, fusion, baroque, architecture, indigenous, art, form, colonial, south, america, especially, altiplano, highland, bolivia, peru",0.704,FALSE,https://www.wikidata.org/wiki/Q99061754
mestizo,Q7918350,"vegetalismo, practice, shamanism, peruvian, amazonia",0.691,TRUE,https://www.wikidata.org/wiki/Q7918350
mestizo,Q15309715,"people, descent, wikimedia, category, wikimedia, category",0.69,TRUE,https://www.wikidata.org/wiki/Q15309715
mestizo,Q1806552,"rebellion, túpac, amaru, ii, uprising, native, peasant, bourbon, reform, spanish, viceroyalty, peru",0.682,TRUE,https://www.wikidata.org/wiki/Q1806552
mestizos,Q106713,"mestizo, casta, multiracial, people, mestiza, indo, mestizo, mestizo, mestiza, mestiza, mestizaje, mestiso, spanish, term, denote, person, european, indigenous, american, ancestry",0.969,TRUE,https://www.wikidata.org/wiki/Q106713
mestizos,Q6011525,"mestizo, castas, new, spain, ethnic, group, residency, mestizo, casta, mixed, ethnic, group, spanich, colonial, america",0.836,TRUE,https://www.wikidata.org/wiki/Q6011525
mestizos,Q16151565,"mestizo, united, state, ethnic, group, residency, mestizo, hispanic, latino, american, ethnic, group",0.833,TRUE,https://www.wikidata.org/wiki/Q16151565
mestizos,Q6011515,"mestizo, mexico, ethnic, group, mestizo, mexican, ethnic, group",0.786,TRUE,https://www.wikidata.org/wiki/Q6011515
mestizos,Q18343999,"mestizo, venezuela, ethnic, group, mestizo, venezuelan, venezuelan, ethnic, group",0.761,TRUE,https://www.wikidata.org/wiki/Q18343999
mestizos,Q20141564,"ejido, matlapa, mestizo, human, settlement, human, settlement, mexico",0.716,FALSE,https://www.wikidata.org/wiki/Q20141564
mestizos,Q23686436,"punta, mestizo, peninsula, peninsula, córdoba, department, colombia",0.578,FALSE,https://www.wikidata.org/wiki/Q23686436
mestizos,Q23686434,"isla, mestizo, island, island, colombia",0.546,FALSE,https://www.wikidata.org/wiki/Q23686434
mestizos,Q6011523,"mestizo, musical, group, spanish, rock, band",0.482,FALSE,https://www.wikidata.org/wiki/Q6011523
mestizos,Q57234620,"indigenous, mestizo, version, edition, translation, first, book, marisol, de, la, cadena",0.404,TRUE,https://www.wikidata.org/wiki/Q57234620
metis,Q72698025,"eastern, tribal, indian, society, maine, historical, society, historical, society, maine, united, state",0.769,TRUE,https://www.wikidata.org/wiki/Q72698025
metis,Q6950139,"métis, nation, british, columbia, political, organization, nation, british, columbia, canadian, organization, representing, métis, people",0.768,TRUE,https://www.wikidata.org/wiki/Q6950139
metis,Q6950137,"métis, french, language, canadian, french, french, français, métis, variety, french, used, métis, people",0.74,TRUE,https://www.wikidata.org/wiki/Q6950137
metis,Q55703384,"misha, misha, nogha, chocholak, misha, nogha, misha, chocholak, u, author, native, american, cree, background",0.734,TRUE,https://www.wikidata.org/wiki/Q55703384
metis,Q7914227,"vancouver, métis, community, association, vancouver, community, association, métis, community, organization, canada",0.725,TRUE,https://www.wikidata.org/wiki/Q7914227
metis,Q51479329,"fossil, sponge, organic, remains, quebec, group, little, publication, montreal, view, book",0.672,FALSE,https://www.wikidata.org/wiki/Q51479329
metis,Q6950144,"métis, national, council, advocacy, group, political, organization, national, council, represents, métis, nation, nationally",0.667,TRUE,https://www.wikidata.org/wiki/Q6950144
metis,Q6950140,"métis, nation, alberta, political, organization, nation, alberta, non, profit, organisation",0.665,TRUE,https://www.wikidata.org/wiki/Q6950140
metis,Q6950142,"métis, nation, ontario, political, organization, nation, ontario, mno, representative, body, métis, nation, ontario",0.664,TRUE,https://www.wikidata.org/wiki/Q6950142
metis,Q51510253,"new, specie, fossil, sponge, little, province, quebec, canada, publication, montreal, view, book",0.662,FALSE,https://www.wikidata.org/wiki/Q51510253
mohammedan,Q60755390,"literary, society, organization",0.783,TRUE,https://www.wikidata.org/wiki/Q60755390
mohammedan,Q2367463,"word, formerly, common, term, referring, islam",0.775,TRUE,https://www.wikidata.org/wiki/Q2367463
mohammedan,Q42193074,"conquest, egypt, north, africa, creative, work",0.686,TRUE,https://www.wikidata.org/wiki/Q42193074
mohammedan,Q99222909,"catholic, encyclopedia, confraternities, encyclopedia, article",0.685,TRUE,https://www.wikidata.org/wiki/Q99222909
mohammedan,Q19094101,"system, theology",0.672,TRUE,https://www.wikidata.org/wiki/Q19094101
mohammedan,Q104968492,"catalogue, ivory, carving, christian, era, example, art, carving, bone, department, british, mediaeval, antiquity, ethnography, british, museum, museum, catalogue",0.663,TRUE,https://www.wikidata.org/wiki/Q104968492
mohammedan,Q58366626,"handbook, decorative, dimand, academic, journal, article",0.641,TRUE,https://www.wikidata.org/wiki/Q58366626
mohammedan,Q113473641,"pagan, survival, civilisation, review, review, zeitschrift, für, sozialforschung",0.616,TRUE,https://www.wikidata.org/wiki/Q113473641
mohammedan,Q87660342,"upper, primary, school, state, school, school, kottayam, district, kerala",0.573,FALSE,https://www.wikidata.org/wiki/Q87660342
mohammedan,Q6893503,"sporting, ground, venue, football, stadium, kolkata, india",0.526,FALSE,https://www.wikidata.org/wiki/Q6893503
mohammedans,Q113493444,"chinese, group, mohammedan, chair, bearer, postcard, missionary, postcard, society, propagation, gospel",0.81,TRUE,https://www.wikidata.org/wiki/Q113493444
mohammedans,Q63314480,"travel, arabia, comprehending, account, territory, hedjaz, mohammedan, regard, sacred, edition, version, edition, translation, edition, book, john, lewis, burckhardt",0.752,TRUE,https://www.wikidata.org/wiki/Q63314480
mohammedans,Q19024563,"prayer, mohammedan, everywhere",0.576,TRUE,https://www.wikidata.org/wiki/Q19024563
mohammedans,Q19024567,"prayer, mohammedan",0.423,TRUE,https://www.wikidata.org/wiki/Q19024567
mongoloid,Q19891911,"indo, people, assam, ethnic, group, group, people, historically, migrated, india",0.798,TRUE,https://www.wikidata.org/wiki/Q19891911
mongoloid,Q11410826,"proto, historical, term, used, refer, sub, type, race, classified, william, howells",0.791,TRUE,https://www.wikidata.org/wiki/Q11410826
mongoloid,Q207912,"ethnic, group, ethnicity",0.678,TRUE,https://www.wikidata.org/wiki/Q207912
mongoloid,Q11500981,"neo, race, human, categorization",0.641,TRUE,https://www.wikidata.org/wiki/Q11500981
mongoloid,Q1135825,"epicanthic, fold, class, anatomical, entity, class, disease, facial, feature, skin, fold, canthal, anomaly, anatomical, line, eyelid, particular, anatomical, entity, epicanthal, fold, palpebronasal, fold, fold, epicanthus, eye, fold, fold, upper, eye, lid",0.633,TRUE,https://www.wikidata.org/wiki/Q1135825
mongoloid,Q6899769,"musical, work, composition, original, song, written, composed, gerald, recorded, released, devo",0.599,FALSE,https://www.wikidata.org/wiki/Q6899769
mongoloid,Q20255706,"mongoloidi, translated, finnisn, language, version",0.598,FALSE,https://www.wikidata.org/wiki/Q20255706
mongoloid,Q8546951,"wikimedia, category, wikimedia, category",0.461,TRUE,https://www.wikidata.org/wiki/Q8546951
mongoloid,Q116457612,"jocko, homo, single, release, booji, boy, record, jocko, homo, u, single, booji, boy, record",0.432,FALSE,https://www.wikidata.org/wiki/Q116457612
mongoloid,Q116457604,"jocko, homo, single, jocko, homo, debut, single, devo",0.414,FALSE,https://www.wikidata.org/wiki/Q116457604
moor,Q64811664,"brown, roman, temporary, camp, archaeological, site, part, world, heritage, site, united, kingdom",0.815,FALSE,https://www.wikidata.org/wiki/Q64811664
moor,Q5602882,"green, hamlet, human, settlement, united, kingdom",0.802,FALSE,https://www.wikidata.org/wiki/Q5602882
moor,Q107012077,"exceptional, iridium, concentration, found, allerød, younger, dryas, transition, sediment, bodmin, southwest, england, scholarly, conference, abstract, abstract, william, marshall, quaternary, international",0.79,FALSE,https://www.wikidata.org/wiki/Q107012077
moor,Q112248476,"landscape, painting, painting, modern, poland",0.788,FALSE,https://www.wikidata.org/wiki/Q112248476
moor,Q15262572,"northern, human, settlement, human, settlement, united, kingdom",0.787,FALSE,https://www.wikidata.org/wiki/Q15262572
moor,Q1576290,"hanoverian, geest, natural, region, landscape, hanover, nienburg, german, state, lower, saxony",0.787,FALSE,https://www.wikidata.org/wiki/Q1576290
moor,Q60685724,"goldenstedter, site, community, importance, proposed, site, community, importance, protected, area, european, union, defined, habitat, directive, niedersachsen, germany",0.785,FALSE,https://www.wikidata.org/wiki/Q60685724
moor,Q60685046,"renzeler, proposed, site, community, importance, site, community, importance, protected, area, european, union, defined, habitat, directive, niedersachsen, germany",0.785,FALSE,https://www.wikidata.org/wiki/Q60685046
moor,Q60685778,"hohes, site, community, importance, proposed, site, community, importance, protected, area, european, union, defined, habitat, directive, niedersachsen, germany",0.785,FALSE,https://www.wikidata.org/wiki/Q60685778
moor,Q1050631,"plymouth, view, constituency, house, common, parliamentary, constituency, united, kingdom, onwards",0.784,FALSE,https://www.wikidata.org/wiki/Q1050631
moors,Q169260,"moor, ethnic, group, moriscos, moriscoes, medieval, muslim, inhabitant, maghreb, iberian, peninsula, sicily, malta",0.839,TRUE,https://www.wikidata.org/wiki/Q169260
moors,Q98596477,"moorish, style, art, style, based, architecture, decorative, art, muslim, inhabitant, moor, north, west, africa, century, southern, spain",0.828,TRUE,https://www.wikidata.org/wiki/Q98596477
moors,Q110188678,"ried, vorarlberg, natural, cultural, landscape, find, throughout, vorarlberg, often, includes, landing, moor",0.812,FALSE,https://www.wikidata.org/wiki/Q110188678
moors,Q110854379,"tread, path, traverse, investigating, slavery, early, medieval, western, britain, academic, chapter",0.802,FALSE,https://www.wikidata.org/wiki/Q110854379
moors,Q7070677,"nuwaubian, nation, religious, organization, hate, group, nuwaubian, movement, united, nuwaubian, nation, moor, ansaru, allah, community, holy, tabernacle, ministry, yamassee, native, american, moor, creek, nation, nuwaubian, nation, moor, u, religious, group, founded, dwight, york",0.795,FALSE,https://www.wikidata.org/wiki/Q7070677
moors,Q23660880,"moor, christian, abanilla, festival, regional, tourist, interest, region, murcia",0.787,TRUE,https://www.wikidata.org/wiki/Q23660880
moors,Q2636673,"aljama, alhama, alfama, city, exclusively, occupied, moor, jew, neighborhood, christian, city, occupied, ethnic, group, middle, age",0.783,TRUE,https://www.wikidata.org/wiki/Q2636673
moors,Q102276979,"exhausted, medieval, use, moor, mire, common, eastern, netherlands, academic, chapter, chapter, published",0.776,FALSE,https://www.wikidata.org/wiki/Q102276979
moors,Q5650710,"moor, christian, alcoy, party, popular, festival, take, place, city, alcoy, alicante, valencian, community",0.769,TRUE,https://www.wikidata.org/wiki/Q5650710
moors,Q113496477,"moorish, sovereign, citizen, anti, government, group, moorish, sovereign, moor, collection, independent, organization, lone, individual, emerged, early, offshoot, antigovernment, sovereign, citizen, movement",0.767,FALSE,https://www.wikidata.org/wiki/Q113496477
mulatto,Q191923,"historical, race, concept, human, mulattress, mulato, mulatta, mulata, racial, classification",0.939,TRUE,https://www.wikidata.org/wiki/Q191923
mulatto,Q5193390,"cultural, highly, educated, black, person, according, trey, elli",0.824,TRUE,https://www.wikidata.org/wiki/Q5193390
mulatto,Q115997244,"dismantling, tragic, interrogating, racial, authenticity, genre, black, motherhood, african, american, fiction, doctor, philosophy, thesis, doctoral, thesis, gyasi, byng, francisco, university, rochester",0.798,TRUE,https://www.wikidata.org/wiki/Q115997244
mulatto,Q64277831,"register, black, communicant, showing, status, black, free, unfree, name, owner, case, unfree, naid, collection, series, national, archive, record, holding",0.778,TRUE,https://www.wikidata.org/wiki/Q64277831
mulatto,Q7832650,"tragic, stock, character, stereotypical, fictional, character, century, american, literature",0.748,TRUE,https://www.wikidata.org/wiki/Q7832650
mulatto,Q115534652,"ohio, black, code, ohio, black, code, ohio, black, code, section, enacted, general, assembly, state, ohio, first, day, june, black, person, shall, permitted, settle, reside, state, unless, shall",0.691,TRUE,https://www.wikidata.org/wiki/Q115534652
mulatto,Q15259470,"people, descent, wikimedia, category, wikimedia, category",0.645,TRUE,https://www.wikidata.org/wiki/Q15259470
mulatto,Q50820743,"study, woman, painting, painting, french, school",0.642,TRUE,https://www.wikidata.org/wiki/Q50820743
mulatto,Q97487645,"solitude, comic, version, edition, translation, solitude, solitude, french, edition, pedagogical, comic, uprising, slavery, unesco",0.637,TRUE,https://www.wikidata.org/wiki/Q97487645
mulatto,Q97495711,"solitude, comic, version, edition, translation, pedagogical, comic, uprising, slavery, unesco",0.627,TRUE,https://www.wikidata.org/wiki/Q97495711
mulattoes,Q55787194,"church, lady, protection, mulatto, church, building, church, building, são, cristóvão, brazil",0.507,TRUE,https://www.wikidata.org/wiki/Q55787194
mulattos,Q16201620,"mulatto, haiti, ethnic, minority",0.701,TRUE,https://www.wikidata.org/wiki/Q16201620
métis,Q24890406,"canadian, council, organization, collection, council, within, canada, concerned, betterment, people",0.744,TRUE,https://www.wikidata.org/wiki/Q24890406
métis,Q13315,"michif, mitchif, language, métchif, language, french, cree, language, michif, cree, language, métif, language, mechif, language, michif, language, metchif, language, metif, language, mixed, language, based, cree, french, spoken, people, north, america",0.712,TRUE,https://www.wikidata.org/wiki/Q13315
métis,Q7123346,"paddle, prairie, settlement, designated, place, canada, human, settlement, settlement, alberta, canada",0.703,TRUE,https://www.wikidata.org/wiki/Q7123346
métis,Q8340290,"people, descent, wikimedia, category, wikimedia, category",0.692,TRUE,https://www.wikidata.org/wiki/Q8340290
métis,Q8247324,"people, descent, wikimedia, category, wikimedia, category",0.692,TRUE,https://www.wikidata.org/wiki/Q8247324
métis,Q108195817,"modern, woman, organization",0.688,TRUE,https://www.wikidata.org/wiki/Q108195817
métis,Q43901330,"tenille, campbell, dene, artist, english, river, first, nation",0.668,TRUE,https://www.wikidata.org/wiki/Q43901330
métis,Q115037366,"dansi, vancouver, based, traditional, contemporary, dance, company",0.667,TRUE,https://www.wikidata.org/wiki/Q115037366
métis,Q108172077,"canada, book, book, describes, method, used, government, canada, avoid, fulfilling, agreement, people, stipulated, manitoba, act",0.657,TRUE,https://www.wikidata.org/wiki/Q108172077
métis,Q6950145,"political, organization, government, represents, citizen, saskatchewan",0.65,TRUE,https://www.wikidata.org/wiki/Q6950145
negro,Q111047765,"american, historical, society, learned, society, organization, anhs, society, focused, collecting, historical, material, related, african, american, history",0.88,TRUE,https://www.wikidata.org/wiki/Q111047765
negro,Q114217628,"culture, african, american, culture, historical, term, afroamerican, emancipation",0.873,TRUE,https://www.wikidata.org/wiki/Q114217628
negro,Q42194475,"portrait, outstanding, american, citizen, origin, creative, work, travelling, exhibition, portrait, outstanding, american, origin, exhibition, painting, laura, wheeler, waring, betsy, graf, reyneau",0.862,TRUE,https://www.wikidata.org/wiki/Q42194475
negro,Q23022954,"black, study, life, northern, city, literary, work, black, metropolis, anthropological, sociological, study, african, american, urban, experience, first, half, century",0.849,TRUE,https://www.wikidata.org/wiki/Q23022954
negro,Q115519368,"cavalcade, american, group, work, african, american, book, artwork, created",0.835,TRUE,https://www.wikidata.org/wiki/Q115519368
negro,Q106318934,"ephemera, arthur, spingarn, collection, literature, archival, collection, digital, collection, archival, material, related, african, american, literature, struggle, equality, civil, right, held, ucla",0.832,TRUE,https://www.wikidata.org/wiki/Q106318934
negro,Q42185813,"american, problem, modern, democracy, creative, work",0.827,TRUE,https://www.wikidata.org/wiki/Q42185813
negro,Q829895,"harlem, renaissance, group, action, art, movement, cultural, movement, new, movement, african, american, cultural, movement, new, york, city",0.819,TRUE,https://www.wikidata.org/wiki/Q829895
negro,Q7145376,"patrice, evans, human, assimilated, american, journalist",0.814,TRUE,https://www.wikidata.org/wiki/Q7145376
negro,Q98119441,"delectable, literary, work, delectable, human, consumption, homoeroticism, within, slave, culture, book, vincent, woodard",0.814,TRUE,https://www.wikidata.org/wiki/Q98119441
negroes,Q86735,"afro, german, ethnic, group, german, black, people, black, german, imperial, negro, racial, ethnic, group, germany, african, ancestry",0.857,TRUE,https://www.wikidata.org/wiki/Q86735
negroes,Q19096281,"representative, american, negro",0.814,TRUE,https://www.wikidata.org/wiki/Q19096281
negroes,Q31501365,"enquiry, concerning, intellectual, moral, faculty, literature, negro, version, edition, translation, enquiry, concerning, intellectual, moral, faculty, literature, negro, followed, account, life, work, fifteen, negro, mulatto, distinguished, science, literature, art",0.781,TRUE,https://www.wikidata.org/wiki/Q31501365
negroes,Q20502844,"employment, negro, agriculture, painting, painting, earle, richardson",0.773,TRUE,https://www.wikidata.org/wiki/Q20502844
negroes,Q105573914,"society, relief, free, negro, unlawfully, held, bondage, society, quaker, organization, devoted, abolition, slavery, social, economic, improvement, black",0.772,TRUE,https://www.wikidata.org/wiki/Q105573914
